[
  {
    "author": "张敏",
    "code": "F",
    "type": "数据·正负号",
    "sev": "高",
    "anchor": "报告期内公司因结算货币汇率波动产生的汇兑净损失为-26.14万元、187.85万元和-110.91万元",
    "rev": "报告期内公司因结算货币汇率波动产生的汇兑损益为-26.14万元、187.85万元和-110.91万元（负值表示净收益）",
    "title": "「汇兑净损失」负值实为净收益，正负口径与措辞相悖",
    "desc": "「汇兑净损失」列示为-26.14万元、-110.91万元，负值在会计口径下表示净收益，与「损失」措辞方向矛盾。",
    "advice": "核对财务报告口径后，统一表述为「汇兑损益」并注明各期净收益/净损失方向，避免歧义。"
  },
  {
    "author": "李伟",
    "code": "L",
    "type": "披露·充分性",
    "sev": "中",
    "page": 6,
    "anchor": "报告期后主要产品出口关税税率有所上调",
    "title": "期后关税上调属重大事项，影响量化披露不足",
    "desc": "关税上调属披露时点前的期后重大事项；当前仅定性描述「价格优势下降」，未量化对报告期后业绩影响。",
    "advice": "评估并补充披露关税上调对报告期后经营业绩的量化影响及应对措施，说明是否构成重大不利影响及其判断依据。"
  },
  {
    "author": "王芳",
    "code": "I",
    "type": "表述·绝对化",
    "sev": "中",
    "anchor": "发行人作为国内本行业中的龙头企业",
    "rev": "发行人作为国内本行业的主要企业之一",
    "title": "「本行业中的龙头企业」属绝对化行业地位表述",
    "desc": "原文直接宣称行业龙头地位，但未附第三方行业排名或市场占有率数据支撑。",
    "advice": "补充第三方行业排名或市场占有率数据支撑；无法支撑时改为「行业内主要企业之一」等相对表述。"
  }
]
